<?xml version='1.0' encoding='UTF-8'?>

<!DOCTYPE swatch SYSTEM "swatch.dtd">

<swatch name="FB_LINK_CUR_NORM">

<!-- Base Satellite definition -->
    <sat shape="edgeShp" hover="hoverEvt" click="clickEvt" isBack="true" isVisible="true" isSuper="true" isSub="false" isCur="false" isRest="true" isTip="false" isNoSided="false">
        <slice inCol="238 242 245" outCol="20 169 251" alpha="1" linewidth="1" />
    </sat>

    <sat shape="edgeShp" selection="search" isVisible="true" isSuper="true" isSub="false" isCur="false" isRest="true" isBack="false" isTip="false" isNoSided="false">
        <slice inCol="239 33 37" outCol="238 242 245" alpha="1" linewidth="1" />
    </sat>

<!-- References -->
    <font id="tipFnt" name="Arial" size="12" style="plain" />

    <font id="fixedFnt" name="Monospaced" size="12" style="plain" />

    <shape id="edgeShp" scale="1" anchor="intersect">
    </shape>

    <tooltip id="tooltip" delay="0" length="3000">
        <tip font="tipFnt" label="[/20sREC_NAME]" inCol="255 255 255" outCol="20 169 251" textCol="34 34 34" align="center" isFloating="true" blur="-1" rounded="10" dir="SW" isCorner="false" />
    </tooltip>

    <!-- Hover event -->
    <event id="hoverEvt">
        <show status="Click to show this link menu" />
        <pop tooltip="tooltip" />
    </event>

    <!-- Click event -->
    <event id="clickEvt">
        <popup menu="menu" />
    </event>
    
    <menu id="menu" font="menuFnt">
        <item label="[sREC_NAME]" url="javascript:Display([sREC_ID])" />
    </menu>

    <font id="menuFnt" name="Arial" size="11" style="plain" />
</swatch>

